{
  "$schema": "https://wellmanifest.dev/schemas/hostguard/policy/v1",
  "schema": "wellmanifest.hostguard/policy/v1",
  "id": "linux.generic.host",
  "version": "0.1.0",
  "purpose": "Protect a generic Linux host running a subactor instance from runaway processes.",
  "probe": {
    "intervalSeconds": 30,
    "source": "live-host",
    "signals": ["cpu", "ram", "storage", "power", "fd", "inode", "zombie", "fork_bomb", "runaway"]
  },
  "policy": {
    "unknownPolicy": "reject",
    "effectModel": "observe-default",
    "defaultAction": "observe",
    "escalation": ["observe", "warn", "ticket", "escalate"],
    "kill": {
      "capability": "capability://hostguard/kill/v1",
      "granted": false,
      "never": ["pid:1", "guardian_self", "allowlisted_instance"]
    },
    "forbid": [
      "kill_without_grant",
      "kill_pid_1",
      "kill_guardian_self",
      "kill_allowlisted_instance",
      "treat_top_as_threat",
      "treat_editor_as_host",
      "treat_visible_kill_as_grant",
      "treat_probe_noise_as_debt"
    ]
  },
  "allowlist": [
    {"kind": "comm", "value": "systemd"},
    {"kind": "comm", "value": "sshd"},
    {"kind": "comm", "value": "nginx"},
    {"kind": "cgroup", "value": "system.slice"},
    {"kind": "comm", "value": "hostguard"}
  ],
  "thresholds": {
    "cpuPercent": 90,
    "ramPercent": 90,
    "storagePercent": 90,
    "powerWatts": 200,
    "fdCount": 10000,
    "inodePercent": 90,
    "zombieCount": 50,
    "forkRate": 200
  },
  "classifications": [
    {
      "id": "inventory-vs-runtime",
      "kind": "inventory_vs_runtime",
      "rationale": "A high CPU, RAM, or disk number in top is not a threat until the process is classified against the allowlist, cgroup, and instance services.",
      "actions": [{"do": "classify_before_threat"}, {"do": "observe"}],
      "forbid": ["treat_top_as_threat"]
    },
    {
      "id": "served-artifact",
      "kind": "served_artifact",
      "rationale": "The implementing product must probe the live host (or an injected snapshot of that host). An editor buffer is not the instance.",
      "actions": [{"do": "probe_live_host"}],
      "forbid": ["treat_editor_as_host"]
    },
    {
      "id": "capability-surface",
      "kind": "capability_surface",
      "rationale": "A visible Kill button is not a wellmanifest.poa grant. unknownPolicy=reject; observe+warn+ticket is the default effect.",
      "actions": [{"do": "require_kill_grant"}, {"do": "refuse_kill"}],
      "forbid": ["treat_visible_kill_as_grant", "kill_without_grant"]
    }
  ],
  "questions": [
    "A visible Kill control is not a POA grant. Is capability://hostguard/kill/v1 explicitly granted, or is observe+warn+ticket the only effect?"
  ]
}
